{
  "schema_version": "1.0.0",
  "scope": "poolside-p4-protocol-freeze",
  "decision": "approved-for-p4-protocol-freeze",
  "experiment_id": "poolside-laguna-p4-20261023",
  "formal_plan_sha256": "34a3c7fd3eefb3bd6e4fb6819816e7f659b40e2bcd10a72412ab68b1da07d025",
  "budget_sha256": "14d569289b0807904500a800fbead212555ac8955abe476b6f5bf816f523e4bc",
  "protocol_candidate_sha256": "12b2d704c07248bedff35e9459cb074c1ffa94b3c66a09cb80b67cecb969e3ee",
  "formal_protocol_freeze": true,
  "formal_execution_approval": false,
  "authority": {
    "role": "researcher",
    "basis": "explicit-user-approval",
    "approved_at_local": "2026-10-23T18:37:17+07:00",
    "quote": "Saya menyetujui freeze P4 Replicate 3 dengan formal plan SHA 34a3c7fd3eefb3bd6e4fb6819816e7f659b40e2bcd10a72412ab68b1da07d025, budget SHA 14d569289b0807904500a800fbead212555ac8955abe476b6f5bf816f523e4bc, protocol candidate SHA 12b2d704c07248bedff35e9459cb074c1ffa94b3c66a09cb80b67cecb969e3ee, dan satu kali reset database DVWA lokal untuk preflight, dengan batas USD 0. Persetujuan ini belum mengotorisasi eksekusi formal."
  }
}
