{
  "schema_version": "1.0.0",
  "scope": "poolside-p4-protocol-freeze",
  "decision": "approved-for-p4-protocol-freeze",
  "experiment_id": "poolside-laguna-p4-20261023",
  "formal_plan_sha256": "4b4d5bb3a8a23801ad31bf5ba6e27cca4e9c47c4fc579c08079d39461277267e",
  "budget_sha256": "0944ae8e15f2c914758e546d1408148d55df7780e76b43141d8c4ab233e48aae",
  "protocol_candidate_sha256": "12b2d704c07248bedff35e9459cb074c1ffa94b3c66a09cb80b67cecb969e3ee",
  "formal_protocol_freeze": true,
  "formal_execution_approval": false,
  "authority": {
    "role": "researcher",
    "basis": "explicit-user-approval",
    "approved_at_local": "2026-10-23T15:39:35+07:00",
    "quote": "Saya menyetujui freeze recovery P4 dengan formal plan SHA 4b4d5bb3a8a23801ad31bf5ba6e27cca4e9c47c4fc579c08079d39461277267e, budget SHA 0944ae8e15f2c914758e546d1408148d55df7780e76b43141d8c4ab233e48aae, dan protocol candidate SHA 12b2d704c07248bedff35e9459cb074c1ffa94b3c66a09cb80b67cecb969e3ee."
  }
}
